{
  "$schema": "../schema.json",
  "locale": "he",
  "terms": {
    "optimization": "אופטימיזציה",
    "optimizationPlural": "אופטימיזציות",
    "optimizationTypeRun": "אופטימיזציה",
    "optimizationTypeRunPlural": "אופטימיזציות",
    "optimizationTypeGrid": "סריקה",
    "optimizationTypeBlackbox": "קופסה שחורה",
    "pair": "זוג",
    "program": "תוכנית",
    "task": "משימה",
    "statusPending": "ממתינה",
    "statusValidating": "באימות",
    "statusRunning": "רצה",
    "statusSuccess": "הצליחה",
    "statusFailed": "נכשלה",
    "statusCancelled": "בוטלה",
    "statusPaused": "מושהית",
    "dataset": "דאטאסט",
    "row": "שורה",
    "example": "דוגמה",
    "inputColumn": "עמודת קלט",
    "outputColumn": "עמודת פלט",
    "split": "חלוקה",
    "splitTrain": "אימון",
    "splitVal": "אימות",
    "splitTest": "בדיקה",
    "baseline": "בסיס",
    "signature": "חתימה (Signature)",
    "module": "מודול",
    "optimizer": "אופטימייזר",
    "metric": "פונקציית מדידה (Metric)",
    "score": "ציון",
    "scorePlural": "ציונים",
    "prediction": "תשובה",
    "model": "מודל",
    "provider": "ספק",
    "reflectionModel": "מודל אופטימיזציה",
    "generationModel": "מודל משימה",
    "generationModelShort": "משימה",
    "generationModelPlural": "מודלי משימה",
    "modelConfig": "הגדרות מודל",
    "apiKey": "API key",
    "modelCatalog": "קטלוג מודלים",
    "baselineScore": "ציון בסיס (baseline)",
    "optimizedScore": "ציון סופי (optimized score)",
    "scoreImprovement": "שיפור",
    "exploreTitle": "חיפוש ציבורי",
    "notificationNewOpt": "אופטימיזציה חדשה",
    "type": "סוג",
    "error": "שגיאה",
    "examplePlural": "דוגמאות",
    "rowPlural": "שורות",
    "inputColumns": "עמודות הקלט",
    "outputColumnTarget": "עמודת היעד",
    "finalScore": "הציון הסופי",
    "modelPlural": "מודלים",
    "pairPlural": "זוגות",
    "candidate": "מועמד",
    "candidatePlural": "מועמדים",
    "winningCandidate": "מועמד מוביל",
    "cancellationReason": "בוטלה על ידי המשתמש",
    "pauseReason": "הושהתה על ידי המשתמש"
  },
  "messages": {
    "accounts.email_delivery_unavailable": "שליחת אימייל אינה מוגדרת בשרת הזה.",
    "accounts.email_not_verified": "יש לאמת את כתובת האימייל לפני ההתחברות.",
    "accounts.email_send_failed": "לא ניתן לשלוח את אימייל האימות. נסו שוב.",
    "accounts.email_taken": "כתובת האימייל כבר רשומה.",
    "accounts.identity_in_use": "החשבון הזה כבר מחובר לחשבון {term.appName} אחר.",
    "accounts.identity_not_found": "החשבון הזה לא מקושר.",
    "accounts.last_sign_in_method": "זו הדרך היחידה שלך להתחבר. הוסף קודם סיסמה או מפתח גישה.",
    "accounts.link_failed": "לא הצלחנו לקשר את החשבון. נסה שוב.",
    "accounts.not_found": "החשבון לא קיים.",
    "accounts.invalid_credentials": "האימייל או הסיסמה שגויים.",
    "accounts.invalid_email": "כתובת אימייל לא תקינה.",
    "accounts.invalid_reset_code": "קוד האיפוס שגוי או שפג תוקפו.",
    "accounts.invalid_second_factor": "קוד האימות שגוי או שפג תוקפו.",
    "accounts.invalid_verification_code": "קוד האימות שגוי או שפג תוקפו.",
    "accounts.monthly_capacity_reached": "מכסת המשתמשים החודשית התמלאה. משתמשים פעילים קיימים יכולים להמשיך; משתמשים חדשים יוכלו לנסות שוב בחודש הבא.",
    "accounts.password_common": "הסיסמה הזו נפוצה מדי וקלה לניחוש. בחרו סיסמה אחרת.",
    "accounts.password_contains_email": "הסיסמה לא יכולה להכיל את כתובת האימייל שלכם.",
    "accounts.password_too_long": "הסיסמה יכולה להכיל 128 תווים לכל היותר.",
    "accounts.signups_closed": "ההרשמה מושהית כרגע. נסו שוב בקרוב.",
    "accounts.too_many_attempts": "יותר מדי ניסיונות התחברות כושלים. נסו שוב מאוחר יותר.",
    "accounts.totp_setup_required": "יש להתחיל את הגדרת אפליקציית האימות לפני אימות קוד.",
    "accounts.two_factor_required": "יש להזין קוד אימות כדי להשלים את ההתחברות.",
    "accounts.two_factor_unavailable": "אימות דו-שלבי אינו זמין עבור החשבון הזה.",
    "accounts.weak_password": "הסיסמה חייבת לכלול לפחות 8 תווים.",
    "admin.forbidden": "רק מנהלים יכולים לבצע את הפעולה הזו.",
    "admin.invalid_username": "הזן/הזיני שם משתמש.",
    "admin.quota_save_failed": "לא ניתן לשמור את מגבלת המשתמש.",
    "admin.user_not_found": "לא נמצא חשבון עבור '{email}'.",
    "analytics.other_bucket": "אחר",
    "auth.invalid_token": "תוקף ההתחברות פג או שהאסימון לא תקין.",
    "auth.missing_token": "התחבר/י כדי לבצע את הפעולה הזו.",
    "auth.not_configured": "אימות מול השרת עדיין לא הוגדר.",
    "optimization.not_found": "{term.optimization} לא נמצאה: '{optimization_id}'.",
    "optimization.agent_run_not_found": "ריצת הסוכן {run_id} לא נמצאה עבור ה{term.optimization} '{optimization_id}'.",
    "optimization.insufficient_role": "רמת ההרשאה שלך ('{role}') לא מספיקה לפעולה הזו — נדרשת הרשאה '{required}' ומעלה.",
    "optimization.not_finished": "ה{term.optimization} עדיין לא הסתיימה.",
    "optimization.no_result": "ל{term.optimization} אין נתוני תוצאה.",
    "optimization.no_result_pending": "ל{term.optimization} עדיין אין תוצאה.",
    "optimization.repo_version_unknown": "הגרסה הזו אינה חלק מהאופטימיזציה.",
    "optimization.repo_archive_failed": "לא ניתן היה לארוז את המאגר: {reason}",
    "optimization.no_result_for_artifact": "ל{term.optimization} אין תוצאה.",
    "optimization.no_payload": "ל{term.optimization} אין הגדרות שמורות.",
    "optimization.payload_unavailable": "ההגדרות השמורות של ה{term.optimization} אינן זמינות.",
    "optimization.dataset_unavailable": "ה{term.dataset} של ה{term.optimization} אינו זמין.",
    "optimization.no_metric_code": "ל{term.optimization} אין קוד {term.metric}.",
    "optimization.no_model_config": "לא נמצאה הגדרת {term.model}.",
    "optimization.no_program_artifact": "אין תוצר של {term.program}.",
    "optimization.no_program_artifact_scoped": "ל{term.optimization} אין תוצר של {term.program}.",
    "optimization.no_artifact_generic": "ה{term.optimization} לא ייצרה תוצר.",
    "optimization.corrupt_result": "נתוני תוצאת ה{term.optimization} פגומים.",
    "optimization.corrupt_column_mapping": "מיפוי העמודות השמור אינו תקין.",
    "optimization.protected_interactive_sandbox_required": "לא ניתן להעריך או להגיש {term.optimization} מוגנת מתוך תהליך ה-API. נדרשת סביבת {runtime} נפרדת ומחויבת, והיא עדיין אינה זמינה בנקודת קצה זו.",
    "optimization.not_success_status_for_serve": "ה{term.optimization} במצב '{status}' — רק {term.optimizationPlural} שהושלמו בהצלחה אפשר להגיש.",
    "optimization.not_success_status_for_test_results": "ה{term.optimization} במצב '{status}' — רק ל{term.optimizationPlural} שהושלמו בהצלחה יש תוצאות {term.splitTest}.",
    "optimization.cancelled_no_artifact": "ה{term.optimization} בוטלה ולא ייצרה תוצר.",
    "optimization.failed_no_artifact": "ה{term.optimization} נכשלה ולא ייצרה תוצר. שגיאה: {error}",
    "optimization.already_terminal": "ה{term.optimization} כבר במצב סופי '{status}'.",
    "optimization.cannot_delete": "לא ניתן למחוק {term.optimization} במצב '{status}'. בטל/י אותה קודם.",
    "optimization.clone_no_payload": "לאופטימיזציית המקור אין הגדרות שמורות לשכפול.",
    "optimization.retry_no_payload": "לאופטימיזציית המקור אין הגדרות שמורות להרצה חוזרת.",
    "optimization.retry_wrong_status": "אפשר להריץ מחדש רק {term.optimizationPlural} במצב 'נכשלה' או 'בוטלה' — זו במצב '{status}'. ניתן לשכפל אותה במקום.",
    "optimization.cannot_resubmit_payload": "לא ניתן לשלוח מחדש את ההגדרות השמורות: {error}",
    "optimization.resume_wrong_status": "אפשר להמשיך רק {term.optimizationPlural} שנעצרו באמצע — זו במצב '{status}'.",
    "optimization.resume_not_resumable": "אין נקודת המשך שמורה ל{term.optimization} הזו — ניתן להריץ אותה מחדש במקום.",
    "optimization.resume_exhausted": "ה{term.optimization} מיצתה את מספר הניסיונות המרבי ({attempts}) — ניתן להריץ אותה מחדש במקום.",
    "optimization.resume_budget_projected": "האופטימיזציה צפויה לעלות כ-{projected}, מעל התקרה של {limit}. יש להעלות את תקרת ההוצאה מעל {projected} כדי להמשיך.",
    "optimization.pause_wrong_status": "אפשר להשהות רק {term.optimizationPlural} שרצות כרגע — זו במצב '{status}'.",
    "optimization.pause_not_pausable": "אפשר להשהות רק אחרי שנשמרה נקודת המשך ראשונה — אפשר לנסות שוב בעוד רגע.",
    "optimization.pair_not_rerunnable": "לא ניתן להריץ מחדש זוג כשה{term.optimization} במצב '{status}'.",
    "optimization.pair_not_resumable": "לזוג זה אין נקודת המשך שמורה — ניתן להריץ אותו מחדש במקום.",
    "optimization.pairs_label": "{count, plural, one {{term.pair} אחד} two {שני {term.pairPlural}} other {# {term.pairPlural}}}",
    "grid_search.no_best_pair": "לסריקה אין זוג מוביל.",
    "grid_search.no_best_program_artifact": "לזוג המוביל אין תוצר {term.program}.",
    "grid_search.pair_position_missing": "אין זוג במיקום {pair_index} בתוצאות הסריקה.",
    "grid_search.pair_failed_error": "הזוג במיקום {pair_index} נכשל: {error}",
    "grid_search.pair_no_artifact": "לזוג במיקום {pair_index} אין תוצר {term.program}.",
    "grid_search.pair_submission_grid_only": "הגשה לפי זוג זמינה רק בסריקות.",
    "grid_search.pair_test_results_grid_only": "תוצאות {term.splitTest} לפי זוג זמינות רק בסריקות.",
    "grid_search.not_a_grid_search": "ה{term.optimization} אינה סריקה.",
    "grid_search.artifact_per_pair_redirect": "אופטימיזציות סריקה מייצרות תוצרים לכל זוג. השתמש/י ב-GET /optimizations/{optimization_id}/grid-result במקום.",
    "grid_search.failed_no_result": "הסריקה נכשלה ולא הפיקה תוצאה. שגיאה: {error}",
    "grid_search.cancelled_no_result": "הסריקה בוטלה ולא הפיקה תוצאה.",
    "grid_search.no_result_available": "אין תוצאה זמינה לסריקה.",
    "grid_search.corrupt_result": "נתוני תוצאת הסריקה פגומים.",
    "grid_search.no_result_to_modify": "לסריקה אין תוצאה לשנות.",
    "grid_search.cannot_delete_pair": "לא ניתן למחוק זוג כשה{term.optimization} במצב '{status}'. בטל/י את ה{term.optimization} קודם.",
    "filter.invalid_status": "סינון סטטוס לא תקין '{value}'. ערכים חוקיים: {allowed}",
    "filter.invalid_optimization_type": "סינון סוג {term.optimization} לא תקין '{value}'. ערכים חוקיים: {allowed}",